chapter,summary
"Chapter 8.  Failed Strategy:  Judicial Appointments
","Chapter 8 of the book concentrates on the failed strategy of judicial appointments in the pursuit of democratic reform. The text critically evaluates former President Obama’s approach to the Citizens United decision and suggests that his advocacy for a constitutional amendment process was more of a political diversion than a genuine strategic effort to implement change. It argues that Obama, despite understanding the nominal impact of Citizens United on SuperPACs, misdirected public discourse towards a feeble amendment process instead of applying pressure directly to areas that could effectively counteract plutocratic influence.

The chapter further critiques the strategies of professional activists and organizations, asserting that their focus is often misguided and serves to perpetuate the status quo. It discusses the inefficacy of professional activism, which prioritizes fundraising over strategic efficacy, leading to wasted resources and the reinforcement of the plutocratic structure they claim to oppose. Examples such as Greenpeace and other environmental movements illustrate how activist organizations can become more aligned with corporate interests than with genuine reform.

Judicial appointments also come under scrutiny in the chapter, particularly focusing on Obama’s nomination of Merrick Garland to the Supreme Court and the broader implications of such appointments. Garland's nomination, and the support he received from various liberal factions, is characterized as an endorsement that contradicts their purported goals to oppose plutocracy. The text highlights Garland’s judicial record, most notably his role in the Speechnow.org decision, as evidence of his alignment with plutocratic interests. This critique extends to the broader professional activist community, which accepted and supported Garland without adequately questioning his stance or credentials regarding plutocratic issues.

In essence, the chapter posits that existing strategies, including those involving judicial appointments, are insufficient to combat systemic corruption. The text underscores the need for new leaders and strategies, advocating for a departure from fragmented, siloed efforts towards a cohesive movement focused on effective strategic planning. It calls for activism that prioritizes genuine democratic reform over mere political survival or profit motives, highlighting the imperative for a comprehensive reevaluation of approaches to overcome the entrenched plutocratic influence in American democracy."
"Chapter 9.  The Lessons of Seven Amendments
","Chapter 9 of the book delves into the concept of using constitutional amendments as a strategy to overturn Supreme Court decisions deemed undesirable or egregious, specifically focusing on the Citizens United ruling. The chapter scrutinizes the prevalent notion that amendments are the sole means to rectify such decisions and critiques the fraudulent ""only way"" argument propagated by some advocates. It highlights the inefficacy of attempts to garner state legislature resolutions pushing for constitutional amendments, deeming them a mere façade of progress.

The chapter critically examines seven historical amendments often cited by advocates as precedents for overturning Supreme Court rulings. These amendments include the 11th, 13th, 14th, 16th, 19th, 24th, and 26th. The argument proposes that none of these amendments served the purpose of overturning decisions similar to Citizens United because they either addressed federalism issues, were politically expedient but counterproductive, or were aimed at broader societal reforms rather than directly countering Supreme Court rulings.

A detailed discussion is provided about four specific amendments (13th, 14th, 19th, and 26th) and how they were designed to reduce state powers instead of overturning judicial supremacy. The 16th and 24th Amendments exemplify how amendments have historically been used as political diversions, serving more as symbolic gestures or strategic delays rather than genuine solutions to judicial usurpations.

The chapter argues that the 11th Amendment is the closest analogy to what would be needed to overturn Citizens United, as it addressed a specific Supreme Court overreach by directly stripping judicial power. However, it underscores that even this amendment was subject to judicial interpretation that diluted its intended effect, cautioning against the reliability of using amendments to curb Supreme Court authority effectively.

Overall, the chapter asserts that legislative action under the Exceptions Clause is a more practical and effective method for resolving issues like those posed by Citizens United. It proposes that constitutional amendments, particularly those aiming to overturn Supreme Court decisions, are futile and potentially dangerous, as they may lead to unintended consequences given the Supreme Court's history of broad interpretations."
"Chapter 10.  Swing-issue Voting
","Chapter 10, titled ""Swing-issue Voting,"" delves into the strategic use of swing-issue voting as a means to enact progressive change within an electoral system dominated by systemic corruption. The chapter begins by highlighting the inherent challenges faced by progressives, who comprise about 20% of the electorate, in simultaneously winning on multiple issues due to the divisive nature of identity politics and siloed activism. However, the chapter argues that progressives can leverage their numbers to swing elections by focusing on a single, unifying issue: anti-corruption reform, which serves as the strategic focal point capable of dismantling the entrenched plutocracy that blocks majoritarian reforms.

The chapter provides a historical overview, with examples such as the Five Star Movement in Italy, illustrating how digital democracy can facilitate a grassroots movement that prioritizes ideas and projects over traditional party structures. It emphasizes the importance of adopting a leaderless model to prevent the concentration of power and ensure transparency and democratic accountability within the movement.

Progressives are urged to learn from past strategic failures, where ineffective and counterproductive strategies have been peddled by professional activists and opinion makers. Strategies like constitutional amendments, professional activism, and the reliance on charismatic figureheads without a coherent strategy are criticized for their inability to effect real change. The chapter advocates for a shift towards Swing Issue Voting (SIV), focusing solely on systemic anti-corruption reform that can sustain itself and lead to further democratic reforms across various policy areas.

The narrative explains that this strategy requires organizing progressive voters to become independent swing voters willing to pledge their votes for any party or politician that delivers the chosen reform before the next election. This approach demands strict avoidance of unrelated issues and alliances while ensuring unity among voters. SIV necessitates an informed choice of priority reform, efficient unity around the strategy, tabulating pledges, and possibly supporting tools for information dissemination.

A thought experiment is presented to illustrate the potential impact of swing-issue voting, using the 2012 election of President Barack Obama as a case study. The experiment demonstrates how mobilizing a small percentage of voters around a single swing issue could have changed the election's outcome, encouraging voters to use their vote strategically to achieve anti-corruption reform rather than settling for the lesser of two evils. The narrative explores how digital tools can assist in organizing such a movement independently from traditional party frameworks.

Ultimately, the chapter contends that strategic voting focused on addressing systemic corruption will not only restore democracy but also enable the achievement of progressive and majoritarian policy goals across other issue areas. The proposed strategy is framed as the only sustainable path to overcoming the current political stagnation and achieving meaningful reform."
"Chapter 11.  Framing a swing issue
","Chapter 11 delves into the strategic maneuvering required to address the pervasive issue of political corruption within democratic systems. The central focus is on the swing-issue voting (SIV) strategy, which empowers a minority of voters to compel politicians to enact legislation that counters systemic corruption, offering a potentially more effective alternative to constitutional amendments.

Legislation presents several strategic advantages over constitutional amendments, primarily because it allows for clearer definitions and control over jurisdictional boundaries, particularly concerning the Supreme Court's role in political questions. This legislative approach offers Congress a more direct means to influence separation of powers issues, circumventing judicial impositions and restoring balance as championed by historically significant presidents and leaders.

A key aspect discussed is the historical precedent of the successful use of legislation to overthrow unfavorable Supreme Court rulings, exemplified by actions taken by figures like Lincoln and FDR. The chapter critiques the constitutional amendment process's insufficiency in resolving federal versus state power disputes, citing past dilatory amendments and judicial resistance as obstacles to swift reform.

Further, the chapter outlines the problematic entrenchment of judicial supremacy, where unelected Supreme Court justices impose plutocratic rule, subverting democratic principles. The narrative underscores the necessity of legislative remedies that bypass state involvement in amendment ratification processes, especially concerning separation of powers violations aimed at curbing political corruption.

The discussion introduces the potent legal tool of stripping appellate jurisdiction from the Supreme Court—a practice well-established and more consistently adhered to than constitutional amendment processes—to ensure that state's rights and political integrity laws are shielded from judicial overreach.

The analysis extends to consider the Thirteenth Amendment's scope, arguing its potential application beyond its conventional interpretation related to racial slavery. It posits that the amendment, rooted in broader republican ideals, should encompass resistance to all forms of oligarchic and plutocratic oppression, aligning with historical understandings of slavery as defined by the nation's founders.

The narrative suggests that legislative bodies, not courts, should wield the authority to interpret such constitutional abstractions as 'slavery,' following the ethos of representative governance. It criticizes the Supreme Court's historical role in reinforcing plutocracy under the guise of constitutional interpretation, calling for active engagement from citizens and their representatives to reclaim democratic rights.

In conclusion, the chapter presents a roadmap for leveraging the interplay between federal and state powers, bolstered by congressional action, to dismantle the judicially sanctioned plutocratic corruption. It advocates for an assertive reclaiming of the democratic process, targeting judicial supremacy and reinforcing states' sovereign rights to uphold election integrity without undue interference from the Supreme Court."
"Chapter 12  A Simple 
 
 Litmus Test
","Chapter 12 of the book on strategies for democracy presents an innovative approach to counter plutocratic corruption through a state-centric legislative strategy. The author posits that a streamlined and bipartisan-supported litmus test can catalyze significant federal anti-corruption reform. Drawing on historical perspectives, the chapter underscores the necessity for a coherent, state-level initiative that challenges the Supreme Court’s inhibitive jurisprudence on political corruption and empowers states to regain their democratic sovereignty.

The chapter advocates for leveraging ""states' rights"" to initiate systemic reform, spotlighting the inconsistency in Republican opposition to voting rights under the guise of states' rights. It critiques the inefficacy of piecemeal reforms such as those proposed in HR 1, arguing that such strategies often serve as fundraising ploys rather than substantive solutions. Instead, the author introduces the ""Eleventh Amendment Enforcement Act,"" aiming to strip the Supreme Court of its jurisdiction over state anti-corruption laws and restore the validity of previously overturned legislation.

Moreover, the narrative emphasizes the importance of employing insurgent politics and strategic voter organization to disrupt the entrenched duopoly and corrupt practices within the political system. It highlights the historical example of the South's swing issue voting strategy as a model for achieving cohesive political influence, urging progressives to adopt a similarly unified approach against corruption.

Finally, the chapter critiques the current political landscape, where progressives are dispersed among various non-strategic concerns while Republicans are misled by divisive rhetoric, emphasizing that successful anti-corruption efforts require competent strategy, direct legislative action, and collaborative state-federal initiatives to effectively restore integrity and democratic principles to the electoral process."